{
  "id": "11111111-0000-4000-8000-000000000001",
  "type": "operation.use_case_profile",
  "canonical_key": "profile.penetration_testing.technical_vulnerability_management.v1",
  "name": "End-to-end penetration testing and technical vulnerability management",
  "version": "0.1.0",
  "status": "active",
  "use_case": {
    "id": "11111111-0000-4000-8000-000000000002",
    "type": "operation.use_case",
    "canonical_key": "technical_security.penetration_testing_vulnerability_management.end_to_end",
    "name": "End-to-end penetration testing and technical vulnerability management",
    "description": "Discovers and watches organisation assets, translates discovery and scanner source data into perceptions, refines technical context, identifies and approves relative risk groups, generates mitigation activities and plans, validates remediation, and establishes monitoring.",
    "domain_refs": [
      "operation",
      "asset",
      "risk",
      "control",
      "compliance",
      "evidence",
      "assurance",
      "integration",
      "automation",
      "perception",
      "agent",
      "telemetry",
      "governance"
    ],
    "trigger_types": [
      "event",
      "schedule",
      "perception",
      "manual_request",
      "agent_initiated"
    ],
    "actor_roles": [
      {
        "type": "identity.role",
        "id": "role.security_decider",
        "canonical_key": "role.security_decider",
        "name": "Security decider"
      },
      {
        "type": "identity.role",
        "id": "role.service_owner",
        "canonical_key": "role.service_owner",
        "name": "Service owner"
      }
    ],
    "agent_roles": [
      {
        "type": "agent.role",
        "id": "agent.role.scout",
        "canonical_key": "agent.role.scout",
        "name": "ScoutAgent"
      },
      {
        "type": "agent.role",
        "id": "agent.role.concept",
        "canonical_key": "agent.role.concept",
        "name": "ConceptAgent"
      },
      {
        "type": "agent.role",
        "id": "agent.role.business_analyst",
        "canonical_key": "agent.role.business_analyst",
        "name": "BusinessAnalystAgent"
      },
      {
        "type": "agent.role",
        "id": "agent.role.architect",
        "canonical_key": "agent.role.architect",
        "name": "ArchitectAgent"
      },
      {
        "type": "agent.role",
        "id": "agent.role.developer",
        "canonical_key": "agent.role.developer",
        "name": "DeveloperAgent"
      },
      {
        "type": "agent.role",
        "id": "agent.role.tester",
        "canonical_key": "agent.role.tester",
        "name": "TestAgent"
      },
      {
        "type": "agent.role",
        "id": "agent.role.operator",
        "canonical_key": "agent.role.operator",
        "name": "OperatorAgent"
      }
    ],
    "input_types": [
      "integration.source_record",
      "telemetry.cloud_event",
      "telemetry.identity_event",
      "telemetry.configuration_item",
      "telemetry.vulnerability_finding",
      "telemetry.alert",
      "telemetry.health_check",
      "telemetry.exposure_finding",
      "telemetry.interaction_result",
      "telemetry.fuzz_result",
      "telemetry.probe_result",
      "perception.perception",
      "perception.observation"
    ],
    "output_types": [
      "perception.perception",
      "perception.observation",
      "operation.understanding_context",
      "risk.relative_group",
      "operation.activity",
      "operation.plan",
      "operation.action",
      "operation.monitoring_profile",
      "assurance.success_criteria",
      "assurance.test_plan",
      "assurance.validation_result",
      "evidence.record",
      "schema.command"
    ],
    "permitted_commands": [
      "schema.command.propose_object",
      "schema.command.update_object",
      "schema.command.propose_relationship",
      "schema.command.attach_evidence",
      "schema.command.classify_event",
      "schema.command.create_finding",
      "schema.command.propose_risk",
      "schema.command.propose_relative_risk_group",
      "schema.command.submit_risk_group_for_review",
      "schema.command.approve_risk_group",
      "schema.command.reject_risk_group",
      "schema.command.propose_activity_set",
      "schema.command.optimise_activity_set",
      "schema.command.propose_plan",
      "schema.command.approve_plan",
      "schema.command.establish_monitoring_profile",
      "schema.command.propose_treatment",
      "schema.command.propose_control_mapping",
      "schema.command.create_task",
      "schema.command.request_human_approval",
      "schema.command.coalesce_objects",
      "schema.command.mark_object_absent_candidate"
    ],
    "validation_profile_ref": {
      "type": "schema.validation_profile",
      "id": "validation_profile.penetration_testing_tvm.v1",
      "canonical_key": "validation_profile.penetration_testing_tvm.v1",
      "name": "Penetration testing and TVM validation profile"
    },
    "evidence_expectations": [
      {
        "type": "evidence.expectation",
        "id": "evidence.expectation.authorised_scope",
        "canonical_key": "evidence.expectation.authorised_scope",
        "name": "Authorised assessment scope"
      },
      {
        "type": "evidence.expectation",
        "id": "evidence.expectation.vulnerability_detection",
        "canonical_key": "evidence.expectation.vulnerability_detection",
        "name": "Vulnerability detection evidence"
      },
      {
        "type": "evidence.expectation",
        "id": "evidence.expectation.retest_result",
        "canonical_key": "evidence.expectation.retest_result",
        "name": "Retest result evidence"
      }
    ],
    "handoff_rules": [
      {
        "name": "Scout to Concept classification handoff",
        "from_ref": {
          "type": "agent.role",
          "id": "agent.role.scout",
          "canonical_key": "agent.role.scout",
          "name": "ScoutAgent"
        },
        "to_ref": {
          "type": "agent.role",
          "id": "agent.role.concept",
          "canonical_key": "agent.role.concept",
          "name": "ConceptAgent"
        },
        "trigger": "A source record or smetion output creates a candidate asset, exposure, vulnerability, or access perception.",
        "expected_output_types": [
          "perception.perception",
          "schema.command"
        ]
      },
      {
        "name": "Approved risk group to mitigation design handoff",
        "from_ref": {
          "type": "identity.role",
          "id": "role.security_decider",
          "canonical_key": "role.security_decider",
          "name": "Security decider"
        },
        "to_ref": {
          "type": "agent.role",
          "id": "agent.role.architect",
          "canonical_key": "agent.role.architect",
          "name": "ArchitectAgent"
        },
        "trigger": "The selected relative risk group is approved by the configured deciders.",
        "expected_output_types": [
          "operation.activity",
          "operation.plan",
          "assurance.success_criteria"
        ]
      }
    ],
    "approval_policy_ref": {
      "type": "governance.policy",
      "id": "policy.penetration_testing_tvm.approval.v1",
      "canonical_key": "policy.penetration_testing_tvm.approval.v1",
      "name": "Penetration testing and TVM approval policy"
    },
    "success_criteria": "The use case is complete when source records are translated into traceable perceptions, schema commands are validated and approved where required, mitigation plans have testable success criteria, and established changes are watched by an active monitoring profile.",
    "failure_modes": [
      {
        "name": "Out-of-scope active interaction",
        "failure_type": "scope_violation",
        "response": "Block the command, preserve evidence, and require human review before any further interaction."
      },
      {
        "name": "Low-confidence smetion output",
        "failure_type": "low_confidence_perception",
        "response": "Route the perception to agent or human review before canonical update commands can be committed."
      },
      {
        "name": "Unapproved risk group",
        "failure_type": "approval_gate_unmet",
        "response": "Block mitigation planning commands until a decider-approved relative risk group exists."
      }
    ],
    "parameter_schema": [
      {
        "name": "organisation_ref",
        "value_type": "ref",
        "required": true,
        "purpose": "Organisation being assessed."
      },
      {
        "name": "scope_ref",
        "value_type": "ref",
        "required": true,
        "purpose": "Authorised assessment scope."
      },
      {
        "name": "deciders",
        "value_type": "ref_array",
        "required": true,
        "purpose": "People authorised to review, select, and approve the relevant risk group and mitigation direction."
      },
      {
        "name": "asset_sources",
        "value_type": "ref_array",
        "required": true,
        "purpose": "Asset discovery sources, including AWS, Microsoft 365, and scanner outputs."
      },
      {
        "name": "assetsInteractor_ref",
        "value_type": "ref",
        "required": true,
        "purpose": "External interaction, scanning, probing, and fuzzing tool."
      },
      {
        "name": "interaction_modes",
        "value_type": "enum",
        "required": true,
        "purpose": "Permitted scanner/interactor trust perspectives.",
        "allowed_values": [
          "white_box",
          "grey_box",
          "black_box"
        ]
      },
      {
        "name": "standards_profile_refs",
        "value_type": "ref_array",
        "required": true,
        "purpose": "Standards or publication profiles used to guide mitigation activities."
      },
      {
        "name": "risk_method_ref",
        "value_type": "ref",
        "required": true,